{
  "date": "2026-05-14",
  "mode": "SHADOW",
  "package_path": "reports/daily-sales-report-v2/layered/packages/2026-05-14/package.json",
  "data_readiness": {
    "status": "DADOS_OK",
    "checks_summary": "All sources synced within 4h, volume within 30d band, no critical divergences"
  },
  "recipients_requested": ["lucas", "yasmin", "leonardo"],
  "prompt_version": "current",
  "data_builder_version": "v1.0",
  "context_refs": {
    "memory_refs": [
      "shared/daily-sales-analyst/memory/accounts/shopee-budamix-store/rules.md",
      "shared/daily-sales-analyst/memory/accounts/mercado-livre/rules.md",
      "shared/daily-sales-analyst/memory/accounts/amazon/rules.md"
    ],
    "rules_refs": [
      "shared/daily-sales-analyst/memory/context/marketplace-rules.md",
      "shared/daily-sales-analyst/memory/context/qa-standards.md"
    ],
    "himmel_context": null,
    "marketplace_context": null
  },
  "requested_by": "Trader"
}
